{"$schema":"https://json-schema.org/draft/2020-12/schema","title":"traffic.estimate/v1 row","type":"object","required":["target","geography","device","channel","period","metrics"],"properties":{"target":{"type":"string"},"geography":{"type":"string"},"device":{"type":"string"},"channel":{"type":"string"},"period":{"type":"object"},"metrics":{"type":"array","minItems":1,"maxItems":64,"items":{"type":"object"}}},"additionalProperties":false}
