{"target":"example.com","geography":"US","device":"all","channel":"all","period":{"start":"2026-08-01","end":"2026-08-31","granularity":"month","time_zone":"UTC"},"metrics":[{"metric_id":"semrush.visits","semantic_family":"traffic_estimate","value":1000,"unit":"visits_estimate","estimated":true,"definition_version":"2026-09-02","comparison_key":"semrush.visits/month/US/all","source_field":"visits"}]}
